<?xml version="1.0" encoding="UTF-8"?>
<!--Sample XML file generated by XMLSpy v2013 sp1 (http://www.altova.com)-->
<form stop="false" xsi:schemaLocation="http://www.dbs.com.pl/reports/1.0/form file:///C:/workspace/dbs-reports/app/src/main/resources/pl/com/dbs/reports/form-schema-1.0.0.xsd" xmlns="http://www.dbs.com.pl/reports/1.0/form" xmlns:xsi="http://www.w3.org/2001/XMLSchema-instance">
	<fields>
		<field type="text" name="IN_TEXT1" label="Example" value="example text">
			<validator type="required" stop="true"/>
			<validator type="min">12</validator>
			<validator type="max">24</validator>
		</field>
		<field type="number" name="IN_NUMBER1" label="Ilość" value="1">
			<validator type="required" stop="true"/>
			<validator type="min">0</validator>
			<validator type="max">10</validator>
		</field>
		<field type="date" name="IN_DATA1" label="Data od">
			<validator type="required" stop="true"/>
			<validator type="before">IN_DATA2</validator>
		</field>
		<field type="date" name="IN_DATA2" label="Data do">
			<validator type="required" stop="true"/>
			<validator type="after">IN_DATA1</validator>
			<validator type="before">now</validator>
		</field>
	</fields>
</form>
